{
  "version": "1.0.0",
  "locale": "fr",
  "missions": [
    {
      "id": "brush_teeth",
      "title": "Se brosser les dents",
      "description": "Prends soin de ton sourire.",
      "helpSteps": [
        "Mets un peu de dentifrice sur la brosse.",
        "Brosse toutes les faces des dents.",
        "Rince et range la brosse."
      ]
    },
    {
      "id": "wash_hands_before_meal",
      "title": "Se laver les mains avant le repas",
      "description": "Garde les mains propres avant de manger.",
      "helpSteps": [
        "Mouille tes mains.",
        "Utilise du savon et frotte bien.",
        "Rince et sèche."
      ]
    },
    {
      "id": "wash_hands_on_arrival",
      "title": "Se laver les mains en rentrant",
      "description": "Lave-toi les mains en arrivant à la maison avant de poursuivre ta routine.",
      "helpSteps": [
        "Va au lavabo.",
        "Lave-toi les mains avec de l'eau et du savon.",
        "Sèche-toi les mains."
      ]
    },
    {
      "id": "wash_face",
      "title": "Se laver le visage",
      "description": "Commence ou termine la journée avec le visage propre.",
      "helpSteps": [
        "Mouille ton visage avec soin.",
        "Lave-le comme ta famille te l'a appris.",
        "Sèche avec une serviette propre."
      ]
    },
    {
      "id": "comb_hair",
      "title": "Se coiffer",
      "description": "Garde tes cheveux bien rangés.",
      "helpSteps": [
        "Prends le peigne ou la brosse.",
        "Coiffe-toi calmement.",
        "Range le peigne ou la brosse."
      ]
    },
    {
      "id": "take_shower",
      "title": "Prendre une douche",
      "description": "Prends soin de ton hygiène.",
      "helpSteps": [
        "Prépare une serviette et des vêtements propres.",
        "Prends ta douche tranquillement.",
        "Sèche-toi et laisse la salle de bain rangée."
      ]
    },
    {
      "id": "change_clothes",
      "title": "Changer de vêtements",
      "description": "Mets des vêtements propres adaptés au moment.",
      "helpSteps": [
        "Choisis les vêtements.",
        "Change les vêtements portés.",
        "Range-les ou mets-les dans le panier."
      ]
    },
    {
      "id": "put_towel_to_dry",
      "title": "Faire sécher la serviette",
      "description": "Laisse la serviette sécher au bon endroit.",
      "helpSteps": [
        "Prends la serviette utilisée.",
        "Déplie-la pour qu'elle sèche mieux.",
        "Accroche-la à l'endroit prévu."
      ]
    },
    {
      "id": "clean_glasses",
      "title": "Nettoyer ses lunettes",
      "description": "Garde les verres propres pour bien voir.",
      "helpSteps": [
        "Utilise le chiffon adapté.",
        "Nettoie les verres avec soin.",
        "Range le chiffon."
      ]
    },
    {
      "id": "prepare_hygiene_kit",
      "title": "Préparer une trousse d'hygiène",
      "description": "Prépare les affaires d'hygiène nécessaires.",
      "helpSteps": [
        "Vérifie ce qu'il faut.",
        "Mets tout dans une trousse.",
        "Assure-toi de ne rien oublier."
      ]
    },
    {
      "id": "floss_teeth",
      "title": "Utiliser du fil dentaire",
      "description": "Complète le soin de tes dents.",
      "helpSteps": [
        "Prends le fil dentaire.",
        "Utilise-le avec soin comme on te l'a appris.",
        "Jette le fil utilisé."
      ]
    },
    {
      "id": "use_deodorant",
      "title": "Mettre du déodorant",
      "description": "Complète ta routine d'hygiène.",
      "helpSteps": [
        "Prends ton déodorant.",
        "Utilise-le comme ta famille te l'a appris.",
        "Range-le."
      ]
    },
    {
      "id": "make_bed",
      "title": "Faire son lit",
      "description": "Prépare ton lit pour la journée.",
      "helpSteps": [
        "Tends le drap.",
        "Mets l'oreiller à sa place.",
        "Dispose la couverture ou le couvre-lit."
      ]
    },
    {
      "id": "put_away_toys",
      "title": "Ranger les jouets",
      "description": "Remets les jouets à leur place.",
      "helpSteps": [
        "Ramasse les jouets qui ne sont pas rangés.",
        "Trie-les par type ou par emplacement.",
        "Range chaque groupe."
      ]
    },
    {
      "id": "organize_desk",
      "title": "Ranger le bureau",
      "description": "Prépare ton espace pour étudier ou créer.",
      "helpSteps": [
        "Retire ce qui n'a pas besoin de rester sur le bureau.",
        "Range les papiers et le matériel.",
        "Garde à portée de main seulement ce que tu vas utiliser."
      ]
    },
    {
      "id": "dirty_clothes_hamper",
      "title": "Mettre le linge sale dans le panier",
      "description": "Mets les vêtements portés au bon endroit.",
      "helpSteps": [
        "Rassemble les vêtements portés.",
        "Vérifie s'il en reste hors de place.",
        "Mets tout dans le panier."
      ]
    },
    {
      "id": "tidy_room_5_minutes",
      "title": "Ranger la chambre pendant 5 minutes",
      "description": "Fais un petit rangement rapide.",
      "helpSteps": [
        "Choisis une petite zone.",
        "Range ce qui n'est pas à sa place.",
        "Arrête après 5 minutes ou quand la zone est terminée."
      ]
    },
    {
      "id": "organize_bookshelf",
      "title": "Ranger les livres",
      "description": "Garde les livres et BD bien rangés.",
      "helpSteps": [
        "Rassemble les livres qui ne sont pas à leur place.",
        "Trie-les comme tu préfères.",
        "Range-les tous sur l'étagère."
      ]
    },
    {
      "id": "organize_school_materials",
      "title": "Ranger le matériel scolaire",
      "description": "Rends ton matériel facile à trouver.",
      "helpSteps": [
        "Rassemble le matériel scolaire.",
        "Trie-le par type ou matière.",
        "Range chaque objet à sa place."
      ]
    },
    {
      "id": "organize_drawer",
      "title": "Ranger un tiroir",
      "description": "Range un tiroir à la fois.",
      "helpSteps": [
        "Retire ce qui n'a pas sa place dans le tiroir.",
        "Plie ou regroupe les objets.",
        "Remets tout proprement."
      ]
    },
    {
      "id": "organize_shoes",
      "title": "Ranger les chaussures",
      "description": "Mets les chaussures à l'endroit prévu.",
      "helpSteps": [
        "Réunis les paires.",
        "Apporte-les au bon endroit.",
        "Garde les paires ensemble et rangées."
      ]
    },
    {
      "id": "put_belongings_away",
      "title": "Ranger mes affaires",
      "description": "Remets tes affaires à leur place.",
      "helpSteps": [
        "Repère ce qui n'est pas à sa place.",
        "Prends un objet à la fois.",
        "Range chaque chose où elle va."
      ]
    },
    {
      "id": "reset_play_area",
      "title": "Ranger l'espace de jeu",
      "description": "Prépare l'espace pour la prochaine fois.",
      "helpSteps": [
        "Range d'abord les gros jouets.",
        "Rassemble les petites pièces.",
        "Vérifie que le sol est dégagé."
      ]
    },
    {
      "id": "put_activity_materials_away",
      "title": "Ranger le matériel après utilisation",
      "description": "Range le matériel scolaire, de dessin ou de jeu quand tu as terminé.",
      "helpSteps": [
        "Rassemble le matériel utilisé.",
        "Trie-le selon l'endroit où il va.",
        "Range tout."
      ]
    },
    {
      "id": "put_lunchbox_in_kitchen",
      "title": "Apporter la boîte-repas à la cuisine",
      "description": "Mets ta boîte-repas à l'endroit prévu en rentrant.",
      "helpSteps": [
        "Prends la boîte-repas.",
        "Apporte-la à la cuisine.",
        "Pose-la à l'endroit prévu."
      ]
    },
    {
      "id": "empty_lunchbox",
      "title": "Vider la boîte-repas",
      "description": "Sors les boîtes, la gourde et les déchets, puis mets chaque chose à sa place.",
      "helpSteps": [
        "Ouvre la boîte-repas.",
        "Sors les boîtes, la gourde et les déchets.",
        "Range ou jette chaque élément au bon endroit."
      ]
    },
    {
      "id": "put_water_bottle_away",
      "title": "Ranger la gourde",
      "description": "Mets la gourde à l'endroit prévu après l'école ou une activité.",
      "helpSteps": [
        "Prends la gourde.",
        "Apporte-la à l'endroit prévu.",
        "Laisse-la prête à être lavée ou réutilisée."
      ]
    },
    {
      "id": "take_plate_to_sink",
      "title": "Apporter son assiette à l'évier",
      "description": "Après le repas, apporte ton assiette et tes couverts à l'endroit prévu.",
      "helpSteps": [
        "Rassemble l'assiette et les couverts.",
        "Porte-les avec soin.",
        "Pose-les à l'endroit prévu."
      ]
    },
    {
      "id": "take_cup_to_sink",
      "title": "Apporter son verre à l'évier",
      "description": "Après l'avoir utilisé, apporte ton verre à l'endroit prévu.",
      "helpSteps": [
        "Prends le verre.",
        "Porte-le avec soin.",
        "Pose-le à l'endroit prévu."
      ]
    },
    {
      "id": "throw_packaging_away",
      "title": "Jeter les emballages",
      "description": "Mets les emballages et petits déchets dans la bonne poubelle.",
      "helpSteps": [
        "Rassemble les emballages ou déchets.",
        "Repère la bonne poubelle.",
        "Jette-les et laisse l'endroit propre."
      ]
    },
    {
      "id": "clean_own_meal_area",
      "title": "Ranger sa place après le repas",
      "description": "Retire les petits déchets et laisse l'espace utilisé bien rangé.",
      "helpSteps": [
        "Retire l'assiette, le verre et les déchets.",
        "Nettoie les petits restes si nécessaire.",
        "Laisse la chaise et l'espace bien rangés."
      ]
    },
    {
      "id": "prepare_water_bottle",
      "title": "Préparer la gourde",
      "description": "Laisse ta gourde prête.",
      "helpSteps": [
        "Prends la gourde.",
        "Remplis-la d'eau.",
        "Ferme-la et mets-la à l'endroit prévu."
      ]